{
  "view_id": "rwo:view:current-state",
  "view_role": "bridge",
  "title": "Recursive Work Orchestrator current state and ARE boundary",
  "description": "Queryable candidate view from accepted implementation evidence through property findings and residue to the documentation-only RWO-to-ARE boundary.",
  "owner_route": "RWO ontology source owner plus named cross-owner gates",
  "source_refs": [
    "rwo:source:e1",
    "rwo:source:e2",
    "rwo:source:e2-wg",
    "rwo:source:e3",
    "rwo:source:c1",
    "rwo:source:k1"
  ],
  "node_refs": [
    "rwo:source:e1",
    "rwo:source:e2",
    "rwo:source:e2-wg",
    "rwo:source:e3",
    "rwo:source:c1",
    "rwo:source:k1",
    "rwo:ArchitectureElement",
    "rwo:WorkDefinition",
    "rwo:LeafWorkDefinition",
    "rwo:CompositeWorkDefinition",
    "rwo:WorkRun",
    "rwo:Attempt",
    "rwo:WorkGraph",
    "rwo:WorkNode",
    "rwo:EventTriggeredEdge",
    "rwo:EventSelector",
    "rwo:InputMapping",
    "rwo:OutputProjection",
    "rwo:WorkContract",
    "rwo:EventContract",
    "rwo:CommandContract",
    "rwo:CompositionForm",
    "rwo:Sequence",
    "rwo:FanOut",
    "rwo:FanIn",
    "rwo:Gate",
    "rwo:Sidecar",
    "rwo:BoundedRepeat",
    "rwo:ExplicitComposition",
    "rwo:ReleasePolicy",
    "rwo:SidecarLifecyclePolicy",
    "rwo:WorkMessage",
    "rwo:Command",
    "rwo:Event",
    "rwo:EventClassification",
    "rwo:WorkProtocol",
    "rwo:Journal",
    "rwo:OrchestratorKernel",
    "rwo:OrchestrationCursor",
    "rwo:StatusProjection",
    "rwo:ExecutorAdapter",
    "rwo:AuthorityReference",
    "rwo:DomainState",
    "rwo:ConfirmationState",
    "rwo:ArchitectureProfile",
    "rwo:ObservationProjection",
    "rwo:PropertyFinding",
    "rwo:residue.001",
    "rwo:residue.002",
    "rwo:residue.003",
    "rwo:residue.004",
    "rwo:residue.005",
    "rwo:residue.006",
    "rwo:residue.007",
    "rwo:residue.008",
    "rwo:residue.009",
    "rwo:residue.010",
    "rwo:residue.011",
    "rwo:residue.012",
    "rwo:residue.013",
    "rwo:residue.014",
    "rwo:residue.015",
    "rwo:residue.016",
    "rwo:residue.017",
    "rwo:residue.018",
    "rwo:residue.019",
    "rwo:residue.020",
    "rwo:residue.021",
    "rwo:residue.022",
    "rwo:residue.023",
    "rwo:residue.024",
    "rwo:residue.025",
    "rwo:residue.026",
    "rwo:residue.027",
    "rwo:residue.028",
    "rwo:residue.029",
    "rwo:finding.current.dispatch-definition",
    "rwo:precedent:confirmed-dispatch-row",
    "rwo:finding.current.run-identity",
    "rwo:precedent:bound-address",
    "rwo:finding.current.leaf-adapter",
    "rwo:precedent:host-hook-translation",
    "rwo:finding.current.graph-expansion",
    "rwo:precedent:dispatch-launch-plan",
    "rwo:finding.current.sequence",
    "rwo:precedent:declared-handoff",
    "rwo:finding.current.fan-out",
    "rwo:precedent:finite-three-seat-launch",
    "rwo:finding.current.fan-in",
    "rwo:precedent:declared-join",
    "rwo:finding.current.gate-route",
    "rwo:precedent:typed-handoff-label",
    "rwo:finding.current.sidecar",
    "rwo:precedent:apt-ui-projection",
    "rwo:finding.current.bounded-repeat",
    "rwo:precedent:declared-follow-up",
    "rwo:finding.current.protocol",
    "rwo:precedent:aci-command-event-lanes",
    "rwo:finding.current.journal",
    "rwo:precedent:aci-journal",
    "rwo:finding.current.effect-adapter",
    "rwo:precedent:fixed-effect-double",
    "rwo:finding.proposal.implementation-status",
    "rwo:finding.hypothesis.agent-node-collapse",
    "rwo:finding.bridge.no-second-control-plane",
    "rwo:hypothesis:every-graph-node-agent",
    "rwo:stage:entry",
    "rwo:stage:command-acceptance",
    "rwo:stage:history",
    "rwo:stage:observation-admission",
    "rwo:stage:l0-semantics",
    "rwo:stage:artifact-admission",
    "rwo:stage:exact-effect",
    "rwo:stage:effect-lifecycle",
    "rwo:stage:replay",
    "rwo:stage:revalidation",
    "rwo:gate:entry",
    "rwo:gate:aci-lifecycle",
    "rwo:gate:observation-admission",
    "rwo:gate:semantic-evaluator",
    "rwo:gate:artifact-admission",
    "rwo:gate:exact-effect",
    "rwo:gate:effect-adapter",
    "rwo:witness:f1",
    "rwo:witness:f2",
    "rwo:witness:f3",
    "rwo:witness:f4",
    "rwo:witness:f5",
    "rwo:witness:f6",
    "rwo:witness:f7",
    "rwo:witness:f8",
    "rwo:forbidden:second-scheduler",
    "rwo:forbidden:second-integrated-journal",
    "rwo:forbidden:orchestrator-owned-semantic-judgment",
    "rwo:forbidden:evaluator-owned-effect-authority",
    "rwo:forbidden:routing-as-reasoning",
    "rwo:forbidden:result-as-authorization"
  ],
  "relation_refs": [
    "rwo:relation:001-specializes",
    "rwo:relation:002-specializes",
    "rwo:relation:003-specializes",
    "rwo:relation:004-specializes",
    "rwo:relation:005-specializes",
    "rwo:relation:006-specializes",
    "rwo:relation:007-specializes",
    "rwo:relation:008-specializes",
    "rwo:relation:009-specializes",
    "rwo:relation:010-specializes",
    "rwo:relation:011-specializes",
    "rwo:relation:012-specializes",
    "rwo:relation:013-specializes",
    "rwo:relation:014-specializes",
    "rwo:relation:015-specializes",
    "rwo:relation:016-specializes",
    "rwo:relation:017-specializes",
    "rwo:relation:018-specializes",
    "rwo:relation:019-specializes",
    "rwo:relation:020-specializes",
    "rwo:relation:021-specializes",
    "rwo:relation:022-specializes",
    "rwo:relation:023-specializes",
    "rwo:relation:024-specializes",
    "rwo:relation:025-specializes",
    "rwo:relation:026-specializes",
    "rwo:relation:027-specializes",
    "rwo:relation:028-specializes",
    "rwo:relation:029-specializes",
    "rwo:relation:030-specializes",
    "rwo:relation:031-specializes",
    "rwo:relation:032-specializes",
    "rwo:relation:033-specializes",
    "rwo:relation:034-specializes",
    "rwo:relation:035-specializes",
    "rwo:relation:036-specializes",
    "rwo:relation:037-specializes",
    "rwo:relation:038-specializes",
    "rwo:relation:039-specializes",
    "rwo:relation:040-specializes",
    "rwo:relation:041-evaluates",
    "rwo:relation:042-supports",
    "rwo:relation:043-blocked-by",
    "rwo:relation:044-blocked-by",
    "rwo:relation:045-observes",
    "rwo:relation:046-corresponds-to",
    "rwo:relation:047-evaluates",
    "rwo:relation:048-supports",
    "rwo:relation:049-blocked-by",
    "rwo:relation:050-observes",
    "rwo:relation:051-corresponds-to",
    "rwo:relation:052-evaluates",
    "rwo:relation:053-supports",
    "rwo:relation:054-blocked-by",
    "rwo:relation:055-blocked-by",
    "rwo:relation:056-observes",
    "rwo:relation:057-corresponds-to",
    "rwo:relation:058-evaluates",
    "rwo:relation:059-supports",
    "rwo:relation:060-supports",
    "rwo:relation:061-blocked-by",
    "rwo:relation:062-blocked-by",
    "rwo:relation:063-blocked-by",
    "rwo:relation:064-blocked-by",
    "rwo:relation:065-observes",
    "rwo:relation:066-corresponds-to",
    "rwo:relation:067-evaluates",
    "rwo:relation:068-supports",
    "rwo:relation:069-blocked-by",
    "rwo:relation:070-blocked-by",
    "rwo:relation:071-observes",
    "rwo:relation:072-corresponds-to",
    "rwo:relation:073-evaluates",
    "rwo:relation:074-supports",
    "rwo:relation:075-blocked-by",
    "rwo:relation:076-blocked-by",
    "rwo:relation:077-observes",
    "rwo:relation:078-corresponds-to",
    "rwo:relation:079-evaluates",
    "rwo:relation:080-supports",
    "rwo:relation:081-blocked-by",
    "rwo:relation:082-blocked-by",
    "rwo:relation:083-blocked-by",
    "rwo:relation:084-observes",
    "rwo:relation:085-corresponds-to",
    "rwo:relation:086-evaluates",
    "rwo:relation:087-supports",
    "rwo:relation:088-blocked-by",
    "rwo:relation:089-blocked-by",
    "rwo:relation:090-blocked-by",
    "rwo:relation:091-observes",
    "rwo:relation:092-corresponds-to",
    "rwo:relation:093-evaluates",
    "rwo:relation:094-supports",
    "rwo:relation:095-blocked-by",
    "rwo:relation:096-blocked-by",
    "rwo:relation:097-blocked-by",
    "rwo:relation:098-blocked-by",
    "rwo:relation:099-observes",
    "rwo:relation:100-corresponds-to",
    "rwo:relation:101-evaluates",
    "rwo:relation:102-supports",
    "rwo:relation:103-blocked-by",
    "rwo:relation:104-blocked-by",
    "rwo:relation:105-blocked-by",
    "rwo:relation:106-observes",
    "rwo:relation:107-corresponds-to",
    "rwo:relation:108-evaluates",
    "rwo:relation:109-supports",
    "rwo:relation:110-blocked-by",
    "rwo:relation:111-blocked-by",
    "rwo:relation:112-blocked-by",
    "rwo:relation:113-blocked-by",
    "rwo:relation:114-observes",
    "rwo:relation:115-corresponds-to",
    "rwo:relation:116-evaluates",
    "rwo:relation:117-supports",
    "rwo:relation:118-supports",
    "rwo:relation:119-blocked-by",
    "rwo:relation:120-blocked-by",
    "rwo:relation:121-blocked-by",
    "rwo:relation:122-observes",
    "rwo:relation:123-corresponds-to",
    "rwo:relation:124-evaluates",
    "rwo:relation:125-supports",
    "rwo:relation:126-blocked-by",
    "rwo:relation:127-blocked-by",
    "rwo:relation:128-blocked-by",
    "rwo:relation:129-blocked-by",
    "rwo:relation:130-observes",
    "rwo:relation:131-corresponds-to",
    "rwo:relation:132-evaluates",
    "rwo:relation:133-supports",
    "rwo:relation:134-blocked-by",
    "rwo:relation:135-blocked-by",
    "rwo:relation:136-blocked-by",
    "rwo:relation:137-evaluates",
    "rwo:relation:138-supports",
    "rwo:relation:139-blocked-by",
    "rwo:relation:140-blocked-by",
    "rwo:relation:141-blocked-by",
    "rwo:relation:142-blocked-by",
    "rwo:relation:143-blocked-by",
    "rwo:relation:144-blocked-by",
    "rwo:relation:145-blocked-by",
    "rwo:relation:146-blocked-by",
    "rwo:relation:147-blocked-by",
    "rwo:relation:148-blocked-by",
    "rwo:relation:149-evaluates",
    "rwo:relation:150-supports",
    "rwo:relation:151-blocked-by",
    "rwo:relation:152-blocked-by",
    "rwo:relation:153-blocked-by",